{"$id":"https://single-image-studio.invalid/research/slice-10/schemas/hardware.slice10.v0.schema.json","$schema":"https://json-schema.org/draft/2020-12/schema","additionalProperties":false,"properties":{"architecture":{"const":"x64"},"contentHash":{"pattern":"^[0-9a-f]{64}$","type":"string"},"cpuModel":{"maxLength":200000,"minLength":1,"type":"string"},"evidenceBoundary":{"additionalProperties":false,"properties":{"c1":{"const":0},"e1":{"const":0},"formalEvidence":{"const":false},"g1":{"const":0},"o1":{"const":0},"productSupport":{"const":false},"r1Pipeline":{"const":0},"r1ProductRelease":{"const":0},"r1ProductValidation":{"const":0},"releaseAllowlist":{"const":"none"},"releaseApproved":{"const":0},"releaseRegistered":{"const":0},"u1":{"const":0},"v1":{"const":0}},"required":["c1","e1","formalEvidence","g1","o1","productSupport","r1Pipeline","r1ProductRelease","r1ProductValidation","releaseAllowlist","releaseApproved","releaseRegistered","u1","v1"],"type":"object"},"frozenAt":{"pattern":"^[0-9]{4}-[0-9]{2}-[0-9]{2}T[0-9]{2}:[0-9]{2}:[0-9]{2}\\.[0-9]{3}Z$","type":"string"},"hostnameRecorded":{"const":false},"id":{"pattern":"^[A-Za-z0-9][A-Za-z0-9._:@/-]{2,199}$","type":"string"},"logicalProcessors":{"minimum":1,"type":"integer"},"nodeAbi":{"maxLength":200000,"minLength":1,"type":"string"},"nodeNapi":{"maxLength":200000,"minLength":1,"type":"string"},"nodeVersion":{"maxLength":200000,"minLength":1,"type":"string"},"npmVersion":{"maxLength":200000,"minLength":1,"type":"string"},"osRelease":{"maxLength":200000,"minLength":1,"type":"string"},"osVersion":{"maxLength":200000,"minLength":1,"type":"string"},"platform":{"const":"win32"},"schemaVersion":{"const":"hardware.slice10.v0"},"serialRecorded":{"const":false},"totalMemoryBytes":{"minimum":1,"type":"integer"}},"required":["schemaVersion","id","frozenAt","platform","architecture","osRelease","osVersion","cpuModel","logicalProcessors","totalMemoryBytes","nodeVersion","nodeAbi","nodeNapi","npmVersion","hostnameRecorded","serialRecorded","evidenceBoundary","contentHash"],"type":"object"}
