{"architecture":"x64","contentHash":"489f48031d9771eb737f1b412766b2ebb7034e180421550d3cc03f7075485b7c","cpuModel":"13th Gen Intel(R) Core(TM) i9-13980HX","evidenceBoundary":{"c1":0,"e1":0,"formalEvidence":false,"g1":0,"o1":0,"productSupport":false,"r1Pipeline":0,"r1ProductRelease":0,"r1ProductValidation":0,"releaseAllowlist":"none","releaseApproved":0,"releaseRegistered":0,"u1":0,"v1":0},"frozenAt":"2026-08-15T18:03:39.680Z","hostnameRecorded":false,"id":"HARDWARE-WIN32-X64@0.10.0","logicalProcessors":32,"nodeAbi":"127","nodeNapi":"10","nodeVersion":"v22.15.0","npmVersion":"10.9.2","osRelease":"10.0.26200","osVersion":"Windows 11 Home China","platform":"win32","schemaVersion":"hardware.slice10.v0","serialRecorded":false,"totalMemoryBytes":16779960320}
